[
  {
    "id": "toss-tds",
    "role": "design",
    "title": "Toss Design System",
    "url": "https://developers-apps-in-toss.toss.im/design/components.html",
    "authority": "primary",
    "owner": "Viva Republica",
    "license_note": "Do not copy components or assets; keep principles and attribution only.",
    "allowed_purpose": "Cross-functional design-system principles and consistency review.",
    "enabled": true
  },
  {
    "id": "toss-design-operations",
    "role": "design",
    "title": "Toss design-system operations case study",
    "url": "https://toss.tech/article/toss-design-system",
    "authority": "primary",
    "owner": "Viva Republica",
    "license_note": "Use metadata and concise attributed summaries only.",
    "allowed_purpose": "Design-system contribution and edge-case governance.",
    "enabled": true
  },
  {
    "id": "govuk-design-system",
    "role": "design",
    "title": "GOV.UK Design System",
    "url": "https://design-system.service.gov.uk/",
    "authority": "primary",
    "owner": "UK Government Digital Service",
    "license_note": "Follow the source license; store metadata and attributed summaries.",
    "allowed_purpose": "Accessible component and service-pattern review.",
    "enabled": true
  },
  {
    "id": "wcag-22",
    "role": "design",
    "title": "Web Content Accessibility Guidelines 2.2",
    "url": "https://www.w3.org/TR/WCAG22/",
    "authority": "primary",
    "owner": "W3C",
    "license_note": "Normative link and concise requirements mapping only.",
    "allowed_purpose": "Accessibility acceptance criteria.",
    "enabled": true
  },
  {
    "id": "netflix-hawkins-interview",
    "role": "design",
    "title": "How Netflix builds design systems",
    "url": "https://learn.thedesignsystem.guide/p/how-netflix-builds-design-systems",
    "authority": "secondary",
    "owner": "The Design System Guide",
    "license_note": "Secondary inspiration only; do not copy text, components, or assets.",
    "allowed_purpose": "Non-normative design-system team inspiration.",
    "enabled": true
  }
]
